artista,título,letra,gênero
Justin Timberlake,Rock Your Body,"Don't be so quick to walk away 
Dance with me 
I wanna rock your body 
Please stay 
Dance with me 
You don't have to admit you wanna play 

Dance with me 

Just let me rock you 

Till the break of day 

Dance with me 

Got time, but I don't mind 



Just wanna rock you girl 

I'll have whatever you have 

Come on, just give it up girl 

See I've been watching you 

I like the way you move 

So go ahead, girl, just do 

That ass shaking thing you do 



So you grab your girls 

And you grab a couple more 

And you all come meet me 

In the middle of the floor 

Said the air is thick, it's smelling right 

So you blast to the left and you sail to the right 



Don't be so quick to walk away 

Dance with me 

I wanna rock your body 

Please stay 

Dance with me 

You don't have to admit you wanna play 

Dance with me 

Just let me rock you 

Till the break of day 

Dance with me 



I don't mean no harm 

Just wanna rock you girl 

Make a move, but be calm 

Let's go, let's give it up girl 

See it appears to me 

You like the way I move 

I'll tell you what I'm gonna do 

Pull you close and share my groove 



So you grab your girls 

And you grab a couple more 

And you all come meet me 

In the middle of the floor 

Said the air is thick, it's smelling right 

So you blast to the left and you sail to the right 



Don't be so quick to walk away 

Dance with me 

I wanna rock your body 

Please stay 

Dance with me 

You don't have to admit you wanna play 

Dance with me 

Just let me rock you 

Till the break of day 

Dance with me 



Talk to me boy 

No disrespect, I don't mean no harm 

Talk to me boy 

I can't wait to have you in my arms 

Talk to me boy 

Hurry up cause you're taking too long 

Talk to me boy 

Better have you naked by the end of this song 



So what did you come for 

I came to dance with you 

And you know that you don't want to hit the floor 

I came to romance with you 

You're searching for love forever more 

It's time to take a chance 

If love is here on the floor, girl 



Hey 

Dance with me 

Yea 

Come on baby 



Don't be so quick to walk away 

(Don't walk away) 

(Come on and) 

Dance with me 

I wanna rock your body 

(Let me rock your body) 

Please stay 

(Come on and) 

Dance with me 

You don't have to admit you wanna play 

(You don't have to admit you wanna play, just) Dance with me 

Just let me rock you 

(Do do do do) 

Till the break of day 

(Come on and) 

Dance with me 



Talk to me boy 

No disrespect, I don't mean no harm 

Talk to me boy 

But I can't wait to have you in my arms 

Talk to me boy 

Hurry up cause you're taking too long 

Talk to me boy 

Better have you naked by the end of this song 



Don't be so quick to walk away 

(Just think of me and you) 

Don't be so quick to walk away 

(We could do something) 

Don't be so quick to walk away 

(I like the way you look right now) 

Don't be so quick to walk away 

(Come over here baby) 



Are you feeling me? 

Let's do something 

Let's make a bet 

Cause I, gotta have you naked by the end of this song",pop
Bon Jovi,It'S My Life,"This ain't a song for the broken-hearted
No silent prayer for the faith-departed
I ain't gonna be just a face in the crowd
You're gonna hear my voice
When I shout it out loud

It's my life

It's now or never

I ain't gonna live forever

I just want to live while I'm alive

(It's my life)

My heart is like an open highway

Like Frankie said, ""I did it my way""

I just wanna live while I'm alive

It's my life



This is for the ones who stood their ground

For Tommy and Gina who never backed down

Tomorrow's getting harder make no mistake

Luck ain't even lucky

Got to make your own breaks



It's my life

It's now or never

I ain't gonna live forever

I just want to live while I'm alive

(It's my life)

My heart is like an open highway

Like Frankie said, ""I did it my way""

I just wanna live while I'm alive

It's my life



Better stand tall when they're calling you out

Don't bend, don't break, baby, don't back down



It's my life

It's now or never

I ain't gonna live forever

I just want to live while I'm alive

(It's my life)

My heart is like an open highway

Like Frankie said, ""I did it my way""

I just wanna live while I'm alive

It's my life



It's my life

It's now or never

I ain't gonna live forever

I just want to live while I'm alive

(It's my life)

My heart is like an open highway

Like Frankie said, ""I did it my way""

I just wanna live while I'm alive

It's my life",rock
Bon Jovi,Living' On A Prayer,"Once upon a time 
Not so long ago 
Tommy used to work on the docks 
Union's been on strike 
He's down on his luck...

it's tough, so tough 

Gina works the diner all day 

Working for her man, 

she brings home her pay 

For love, for love 



She says we've got to hold on to what we've got 

'Cause it doesn't make a difference 

If we make it or not 

We've got each other and that's a lot 

For love - we'll give it a shot 



Whooah, we're half way there 

Whooah, Livin' on a prayer 

Take my hand and we'll make it - I swear 

Whooah, Livin' on a prayer 



Tommy's got his six string in hock 

Now he's holding in what he used 

To make it talk 

so tough, it's tough 

Gina dreams of running away 

When she cries in the night 

Tommy whispers baby it's okay, someday 



We've got to hold on to what we've got 

'Cause it doesn't make a difference 

If we make it or not 

We've got each other and that's a lot 

For love - we'll give it a shot 



Whooah, we're half way there 

Whooah, Livin' on a prayer 

Take my hand and we'll make it - I swear 

Whooah, Livin' on a prayer 



We've got to hold on ready or not 

You live for the fight when it's all that you've got",rock
Bon Jovi,Always,"This Romeo is bleeding
But you can't see his blood
It's nothing but some feelings
That this old dog kicked up
It's been raining since you left me

Now I'm drowning in the flood

You see I've always been a fighter

But without you I give up

Now I can't sing a love song

Like the way it's meant to be

Well, I guess I'm not that good anymore

But baby, that's just me



And I will love you, baby - Always

And I'll be there forever and a day - Always

I'll be there till the stars don't shine

Till the heavens burst and

The words don't rhyme

And I know when I die, you'll be on my mind

And I'll love you - Always



Now your pictures that you left behind

Are just memories of a different life

Some that made us laugh, some that made us cry

One that made you have to say good-bye

What I'd give to run my fingers through your hair

To touch your lips, to hold you near

When you say your prayers try to understand

I've made mistakes, I'm just a man



When he holds you close, when he pulls you near

When he says the words you've been needing to hear

I'll wish I was him 'cause those words are mine

To say to you till the end of time



Yeah, I will love you baby - Always

And I'll be there forever and a day - Always



If you told me to cry for you

I could

If you told me to die for you

I would

Take a look at my face

There's no price I won't pay

To say these words to you

Well, there ain't no luck

In these loaded dice

But baby if you give me just one more try

We can pack up our old dreams

And our old lives

We'll find a place where the sun still shines



And I will love you, baby - Always

And I'll be there forever and a day - Always

I'll be there till the stars don't shine

Till the heavens burst and

The words don't rhyme

And I know when I die, you'll be on my mind

And I'll love you - Always",rock
Justin Bieber,Sorry,"Paroles de la chanson Sorry par Justin Bieber
You gotta go and get angry at all of my honesty
You know I try, but I don't do too well with apologies
I hope I don't run out of time, could someone call a referee?
'Cause I just need one more shot at forgiveness
I know you know that I made those mistakes maybe once or twice
And by once or twice, I mean maybe a couple of hundred times
So let me, oh, let me redeem, oh, redeem, oh, myself tonight
'Cause I just need one more shot at second chances

Yeah, is it too late now to say sorry?

'Cause I'm missing more than just your body
Oh, is it too late now to say sorry?
Yeah, I know that I let you down
Is it too late to say I'm sorry now?

I'm sorry, yeah
Sorry, yeah
Sorry
Yeah, I know that I let you down
Is it too late to say I'm sorry now?

I'll take every single piece of the blame if you want me to
But you know that there is no innocent one in this game for two
I'll go, I'll go and then you go, you go out and spill the truth
Can we both say the words and forget this?


Yeah, is it too late now to say sorry?
'Cause I'm missing more than just your body
Oh, is it too late now to say sorry?
Yeah, I know that I let you down
Is it too late to say I'm sorry now?
I'm not just tryna get you back on me (Oh, no, no)
'Cause I'm missing more than just your body (Your body)
Oh, is it too late now to say sorry?
Yeah, I know that I let you down
Is it too late to say I'm sorry now?

I'm sorry, yeah
Sorry, oh
Sorry
Yeah, I know that I let you down (I know I let you down)

Is it too late to say I'm sorry now?
I'm sorry, yeah
Sorry, oh
Sorry
Yeah, I know that I let you down (I know I let you down)
Is it too late to say I'm sorry now?",pop hip-hop/rap
Justin Bieber,Peaches,"Paroles de la chanson Peaches par Justin Bieber
[Justin Bieber]
I got my peaches out in Georgia (Oh, yeah, shit)
I get my weed from California (That's that shit)
I took my chick up to the North, yeah (Badass bitch)
I get my light right from the source, yeah (Yeah, that's it)

[Justin Bieber]
And I see you (Oh), the way I breathe you in (In)
It's the texture of your skin
I wanna wrap my arms around you, baby
Never let you go, oh
And I say, oh, there's nothing like your touch
It's the way you lift me up, yeah
And I'll be right here with you 'til the end


[Justin Bieber]
I got my peaches out in Georgia (Oh, yeah, shit)
I get my weed from California (That's that shit)
I took my chick up to the North, yeah (Badass bitch)
I get my light right from the source, yeah (Yeah, that's it)

[Daniel Caesar]
You ain't sure yet, but I'm for ya'
All I could want, all I can wish for
Nights alone that we miss more
And days we save as souvenirs
There's no time, I wanna make more time
And give you my whole life
I left my girl, I'm in my Yorker
Hate to leave her, call it torture

Remember when I couldn't hold her
Left the baggage for a mover

[Justin Bieber]
I got my peaches out in Georgia (Oh, yeah, shit)
I get my weed from California (That's that shit)
I took my chick up to the North, yeah (Badass bitch)
I get my light right from the source, yeah (Yeah, that's it)

[GIVEON]
I get the feeling, so I'm sure (Sure)
Hand in my hand because I'm yours
I can't, I can't pretend, I can't ignore you're right for me
Don't think you wanna know just where I've been, oh

Don't be distracted
The one I need is right in my arms (Oh)
Your kisses taste the sweetest with mine
And I'll be right here with you 'til end of time

[Justin Bieber]
I got my peaches out in Georgia (Oh, yeah, shit)
I get my weed from California (That's that shit)
I took my chick up to the North, yeah (Badass bitch)
I get my light right from the source, yeah (Yeah, that's it)
I got my peaches out in Georgia (Oh, yeah, shit)
I get my weed from California (That's that shit)
I took my chick up to the North, yeah (Badass bitch)
I get my light right from the source, yeah (Yeah, that's it)

I got my peaches out in Georgia (Oh, yeah, shit)
I get my weed from California (That's that shit)
I took my chick up to the North, yeah (Badass bitch)
I get my light right from the source, yeah (Yeah, that's it)
I got my peaches out in Georgia (Oh, yeah, shit)
I get my weed from California (That's that shit)
I took my chick up to the North, yeah (Badass bitch)
I get my light right from the source, yeah (Yeah, that's it)",pop hip-hop/rap
Justin Bieber,What Do You Mean,"Paroles de la chanson What Do You Mean par Justin Bieber
What do you mean? Oh, oh
When you nod your head yes, but you wanna say no
What do you mean? Hey, yeah
When you don't want me to move, but you tell me to go
What do you mean? Oh, what do you mean?
Said you're runnin' outta time, what do you mean?
Oh, oh, oh, what do you mean?
Better make up your mind, what do you mean?

You're so indecisive of what I'm sayin'
Tryna catch the beat, make up your heart
Don't know if you're happy or complainin'
Don't want for us to end, where do I start?


First you wanna go to the left, then you wanna turn right (Right)
Wanna argue all day, makin' love all night (All night)
First you're up, then you're down, and then between ('Tween)
Oh, I really wanna know

What do you mean? Oh, oh
When you nod your head yes, but you wanna say no
What do you mean? Hey, yeah
When you don't want me to move, but you tell me to go
What do you mean? Oh, what do you mean?
Said you're runnin' outta time, what do you mean?
Oh, oh, oh, what do you mean? Better make up your mind
What do you mean?


You're overprotective when I'm leavin'
Tryna compromise, but I can't win
You wanna make a point, but you keep preachin'
You had me from the start, won't let this end

First you wanna go to the left, then you wanna turn right
(Turn right)
Wanna argue all day, makin' love all night (All night)
First you're up, then you're down, and then between ('Tween)
Oh, I really wanna know

What do you mean? Oh, oh (Yeah, yeah, yeah, yeah)
When you nod your head yes, but you wanna say no
What do you mean? (Oh, what do you mean?) Hey, yeah

When you don't want me to move, but you tell me to go
What do you mean? (I wanna know, ooh)
Oh, what do you mean? (Ooh)
Said you're runnin' outta time, what do you mean? (Oh, baby)
Oh, oh, oh, what do you mean? Better make up your mind
What do you mean? (Don't be so selfish, baby, yeah, yeah) Oh, oh
When you nod your head yes, but you wanna say no
What do you mean? (You're so confusin', baby) Hey, yeah
When you don't want me to move (Hey), but you tell me to go
What do you mean? (Be more straightforward)
Oh, what do you mean? (Hey, ah, ah, ah)
Said you're runnin' outta time, what do you mean? (Hey, ah, ah, ah)

Oh, oh, oh, what do you mean?
Better make up your mind, what do you mean?",pop hip-hop/rap
Justin Bieber,Baby,"Paroles de la chanson Baby par Justin Bieber
Ohh wooaah (3x)
You know you love me,I know you care
Just shout whenever, And I'll be there
You want my love, You want my heart
And we will never ever ever be apart

Are we an item? Girl quit playing
Were just friends, What are you saying
Said theres another, Look right in my eyes

My first love broke my heart for the first time,
And I was like
Baby, baby, baby ohhh
Like baby, baby, baby noo
Like baby, baby, baby ohh
I thought youd always be mine mine


Baby, baby, baby ohh
Like baby, baby, baby noo
Like baby, baby, baby ohh
I thought youd always be mine,mine (oh oh)

For you, I would have done whatever
And I just can't believe, we ain't together
And I wanna play it cool, But I'm losin' you
I'll buy you anything, I'll buy you any ring
And im in pieces, Baby fix me
And just shake me til' you wake me from this bad dream

Im going down, down, down, dooown
And I just cant believe my first love would be around.


And I'm like
Baby, baby, baby ohh
Like baby, baby, baby noo
Like baby, baby, baby ohh
I thought youd always be mine, mine

Baby, baby, baby ohh
Like baby, baby, baby noo
Like baby, baby, baby ohhh
I thought youd always be mine, mine

Luda
When I was 13, I had my first love,
There was nobody that compared to my baby,
And nobody came between us or could ever come above
She had me goin' crazy,
Oh I was starstruck,

She woke me up daily,
Don't need no Starbucks.
She made my heart pound,
And skip a beat when I see her in the street and,
At school on the playground,
But I really wanna see her on the weekend,
She know she got me gazin',
Cuz she was so amazin',
And now my heart is breakin',
But I just keep on sayin'...

Baby, baby, baby ohh
Like baby, baby, baby noo
Like baby, baby, baby ohh
I thought youd always be mine, mine

Baby, baby, baby ohh
Like baby, baby, baby noo

Like baby, baby, baby ohh
I thought youd always be mine, mine

(I'm gone)
Yeah, yeah, yeah (6x)
(Now Im all gone, now im all gone, now im all gone)
Gone, gone, gone,(gone)
I'm gone.",pop hip-hop/rap
Justin Bieber,Never Say Never,"Paroles de la chanson Never Say Never par Justin Bieber
Never say never

Yeah Yeah

Never ever ever ever ohh

See I never thought that I could walk through fire.

I never thought that I could take the burn.

I never had the strength to take it higher,

Until I reached the point of no return.

And there's just no turning back,

When your hearts under attack,

Gonna give everything I have,

It's my destiny.

I will never say never! (I will fight)

I will fight till forever! (make it right)

Whenever you knock me down,

I will not stay on the ground.


Pick it up,

Pick it up,

Pick it up,

Pick it up up up,

And never say never.

Ne-Never say never

Ne-Never say never

Ne-Never say never

Never say it never never say it

I never thought I could feel this power.

I never thought that I could feel this free.

I'm strong enough to climb the highest tower.

And I'm fast enough to run across the sea.Ohh

And there's just no turning back,

When your hearts under attack,

Gonna give everything I have,

Cause this is my destiny.

I will never say never! (I will fight)(never say never)


I will fight till forever! (make it right)

Whenever you knock me down,

I will not stay on the ground.

Pick it up,

Pick it up,

Pick it up,

Pick it up, up, up,

And never say never.

Here we go!

Guess who?

JSmith and JB!

I gotcha lil bro.

I can handle him.

Hold up, I

I can handle him.

Now he's bigger than me,

Taller than me.

And he's older than me,


And stronger than me.

And his arms a little bit longer than me.

But he ain't on a JB song with me!

I be trying a chill

They be trying to side with the thrill.

No pun intended, was raised by the power of Will.

Like Luke with the force, when push comes to shove.

Like Cobe with the 4th, ice water with blood. (let's go)

I gotta be the best, and yes

We're the flyest.

Like David and Goliath,

I conquered the giant.

So now I got the world in my hand,

I was born from two stars

So the moon's where I land.

I will never say never! (I will fight)


(never say it never never say it)

I will fight till forever! (make it right)

Whenever you knock me down,

I will not stay on the ground.

Pick it up,

Pick it up,

Pick it up,

Pick it up, up, up,

And never say never.

I will never say never! (I will fight)

(never say it never never say it)

I will fight till forever! (make it right)

Whenever you knock me down,

I will not stay on the ground.

Pick it up,

Pick it up,

Pick it up,

Pick it up, up, up,


And never say never.

Ne-Never say never

(never say it)

Ne-Never say never

(never say it)

Ne-Never say never

(never say it)

And never say never

Ne-Never say never

(never say it)

Ne-Never say never

(never say it)

Ne-Never say never

And never say never, never, never...",pop hip-hop/rap
Seu Jorge,Amiga Da Minha Mulher,"Ela é amiga da minha mulher.
Pois é, pois é..
Mas vive dando em cima de mim.
Enfim, enfim..
Ainda por cima é uma tremenda gata, pra piorar minha situação.
Se fosse mulher feia tava tudo certo, mulher bonita mexe com meu coração.

Se fosse mulher feia tava tudo certo, mulher bonita mexe com meu coração.



[refrão]

Não pego, eu pego, não pego, eu pego, eu não pego não..

Não pego, eu pego, não pego, eu pego, eu não pego não..



Minha mulher me perguntou até: qual é, qual é?

Eu respondi que não tô nem aí.

Menti, menti..

De vez em quando eu fico admirando, é muita areia pro meu caminhão.

Se fosse mulher feia tava tudo certo, mulher bonita mexe com meu coração.

Se fosse mulher feia tava tudo certo, mulher bonita mexe com meu coração.



[refrão]

Não pego, eu pego, não pego, eu pego, eu não pego não..

Não pego, eu pego, não pego, eu pego, eu não pego não..



O meu cunhado já me avisou, que se eu der mole ele vai me entregar.

A minha sogra me orientou, isso não tá certo é melhor parar.

Falei, ela não quis ouvir. pedi, ela não respeitou.

Eu juro! a carne é fraca mas nunca rolou.(2x)



[repete tudo]



[refrão]

Não pego, eu pego, não pego, eu pego, eu não pego não..

Não pego, eu pego, não pego, eu pego, eu não pego não.. (4x)",MPB/samba/soul
Seu Jorge,Mina Do Condominio,"Tô namorando aquela mina
Mas não sei se ela me namora
Mina maneira do condomínio
Lá do bairro onde eu moro(BIS)
Seu cabelo me alucina

Sua boca me devora

Sua voz me ilumina

Seu olhar me apavora

Me perdi no seu sorriso

Nem preciso me encontrar

Não me mostre o paraíso

Que se eu for, não vou voltar

Pois eu vou

Eu digo ""oi"" ela nem nada

Passa na minha calçada

Dou bom dia ela nem liga

Se ela chega eu paro tudo

Se ela passa eu fico todo

Se vem vindo eu faço figa

eu mando um beijo ela não pega

pisco olho ela se nega

Faço pose ela não vê

Jogo charme ela ignora

Chego junto ela sai fora

Eu escrevo ela não lê



Minha mina

Minha amiga

Minha namorada

Minha gata

Minha sina

Do meu condomínio

Minha musa

Minha vida

Minha Monalisa

Minha Vênus

Minha deusa

Quero seu fascínio (BIS)",MPB/samba/soul
Seu Jorge,Burguesinha,"Vai no cabeleireiro
No esteticista
Malha o dia inteiro
Vida de artista
Saca dinheiro

Vai de motorista

Com seu carro esporte

Vai zoar na pista



Final de semana

Na casa de praia

Só gastando grana

Na maior gandaia

Vai pra balada

Dança bate estaca

Com a sua tribo

Até de madrugada



Burguesinha, burguesinha, burguesinha, burguesinha, burguesinha

Só no filé

Burguesinha, burguesinha, burguesinha, burguesinha, burguesinha

Tem o que quer

Burguesinha, burguesinha, burguesinha, burguesinha, burguesinha

No croissant

Burguesinha, burguesinha, burguesinha, burguesinha, burguesinha

Suquinho de maçã

Burguesinha, burguesinha, burguesinha, burguesinha",MPB/samba/soul
Seu Jorge,Carolina,"Carolina é uma menina bem difícil de esquecer
Andar bonito e um brilho no olhar
Tem um jeito adolescente que me faz enlouquecer
E um molejo que não vou te enganar
Maravilha feminina, meu docinho de pavê
Inteligente ela é muito sensual

Eu te confesso que estou apaixonado por você



O Carolina isso é muito natural

Carolina eu preciso de você

Carolina não vou suportar não te ver

Carolina eu preciso te falar

Carolina eu vou amar você



De segunda a segunda eu fico louco pra te ver

Quando eu te ligo você quase nunca está

Isso era outra coisa que eu queria te dizer

não temos tempo então melhor deixar pra lá

a princípio no Domingo o que você quer fazer

faça um pedido que eu irei realizar

olha aí amigo eu digo que ela só me dá prazer

Essa mina Carolina é de abalar



Ô Carolina eu preciso de você

Ô Carolina não vou suportar não te ver

Ô Carolina eu preciso te falar

Ô Carolina eu vou amar você

Carolina, Carolina



Carolina, preciso te encontrar

Carolina, me sinto muito só

Carolina, preciso te dizer

Ô Carolina eu só quero amar você

Carol, Carol, Carol...",MPB/samba/soul
Sabrina Carpenter,Please Please Please,"Paroles de la chanson Please Please Please par Sabrina Carpenter
I know I have good judgment, I know I have good taste
It's funny and it's ironic that only I feel that way
I promise 'em that you're different and everyone makes mistakes
But just don't
I heard that you're an actor, so act like a stand-up guy
Whatever devil's inside you, don't let him out tonight
I tell them it's just your culture, and everyone rolls their eyes
Yeah, I know
All I'm asking, baby


Please, please, please
Don't prove 'em right
And please, please, please
Don't bring me to tears when I just did my makeup so nice
Heartbreak is one thing, my ego's another
I beg you, don't embarrass me, motherfucker, oh
Please, please, please (Ah)

Well, I have a fun idea, babe (Uh-huh), maybe just stay inside
I know you're cravin' some fresh air, but the ceiling fan is so nice (It's so nice, right?)
And we could live so happily if no one knows that you're with me
I'm just kidding, but really (Kinda), really, really


Please, please, please (Please don't prove 'em right)
Don't prove 'em right
And please, please, please
Don't bring me to tears when I just did my makeup so nice
Heartbreak is one thing (Heartbreak is one thing), my ego's another (Ego's another)
I beg you, don't embarrass me, motherfucker, oh
Please, please, please (Ah)

If you wanna go and be stupid
Don't do it in front of me
If you don't wanna cry to my music
Don't make me hate you prolifically
Please, please, please (Please)
Please, please, please (Please)
Please (Please), please (Please), please

(Ah)",pop
